### ISSUE TITLE
Lua server not responding

### ISSUE THREAD

**Issue by PeterNashaat** [threefoldfoundation/lapis-wiki#35]
- no logs in lua server

**Comment by PeterNashaat** [comment]
- normally when you access any wiki we get log looks like that 
![image](https://user-images.githubusercontent.com/13523434/62282064-35d3cd80-b44f-11e9-9b1f-7bac33679e8c.png)

- but when the wikis are down no requests shows up in the logs at all , and it's not the host issue as there other website containers that don't have the same issue as this container .  

- i'm still investigating if the requests reach the container during the down time

**Comment by PeterNashaat** [comment]
- it's issue in the Openpublish


- the requests are going to the wikis container :-

```
14:25:25.401690 IP 10.102.90.219.41772 > 172.18.0.176.http-alt: Flags [P.], seq 1:524, ack 1, win 229, options [nop,nop,TS val 4144734861 ecr 1919612772], length 523: HTTP: GET / HTTP/1.1
14:25:25.401706 IP 172.18.0.176.http-alt > 10.102.90.219.41772: Flags [.], ack 524, win 235, options [nop,nop,TS val 1919612788 ecr 4144734861], length 0
14:25:25.687642 IP 10.102.90.219.41774 > 172.18.0.176.http-alt: Flags [S], seq 3320621142, win 29200, options [mss 1460,sackOK,TS val 4144735147 ecr 0,nop,wscale 7], length 0
14:25:25.687665 IP 172.18.0.176.http-alt > 10.102.90.219.41774: Flags [S.], seq 3523692561, ack 3320621143, win 28960, options [mss 1460,sackOK,TS val 1919613074 ecr 4144735147,nop,wscale 7], length 0
14:25:25.689477 IP 10.102.90.219.41774 > 172.18.0.176.http-alt: Flags [.], ack 1, win 229, options [nop,nop,TS val 4144735149 ecr 1919613074], length 0
14:25:25.690507 IP 10.102.90.219.41774 > 172.18.0.176.http-alt: Flags [P.], seq 1:549, ack 1, win 229, options [nop,nop,TS val 4144735149 ecr 1919613074], length 548: HTTP: GET / HTTP/1.1
14:25:25.690517 IP 172.18.0.176.http-alt > 10.102.90.219.41774: Flags [.], ack 549, win 235, options [nop,nop,TS val 1919613077 ecr 4144735149], length 0
14:25:26.252985 IP 10.102.90.219.41776 > 172.18.0.176.http-alt: Flags [S], seq 243261602, win 29200, options [mss 1460,sackOK,TS val 4144735713 ecr 0,nop,wscale 7], length 0
14:25:26.253014 IP 172.18.0.176.http-alt > 10.102.90.219.41776: Flags [S.], seq 3041890301, ack 243261603, win 28960, options [mss 1460,sackOK,TS val 1919613640 ecr 4144735713,nop,wscale 7], length 0
14:25:26.254566 IP 10.102.90.219.41776 > 172.18.0.176.http-alt: Flags [.], ack 1, win 229, options [nop,nop,TS val 4144735715 ecr 1919613640], length 0
14:25:26.255397 IP 10.102.90.219.41776 > 172.18.0.176.http-alt: Flags [P.], seq 1:555, ack 1, win 229, options [nop,nop,TS val 4144735715 ecr 1919613640], length 554: HTTP: GET / HTTP/1.1
14:25:26.255407 IP 172.18.0.176.http-alt > 10.102.90.219.41776: Flags [.], ack 555, win 235, options [nop,nop,TS val 1919613642 ecr 4144735715], length 0
```

**Comment by abom** [comment]
Currently, the new version of openpublish is being tested.

**Comment by abom** [comment]
Not relevant, new publishing system won't need this repo.
